{
  "lastUpdated": "2025-12-12T14:05:24.218867",
  "totalReviewScales": 0,
  "reviewedScales": [
    "0",
    "g",
    "j",
    "VbDi",
    "S0rOkK",
    "sye",
    "cm",
    "PTM",
    "S",
    "wjeSggJWQTSO",
    "S7",
    "GL",
    "Fwz6",
    "zCcLkD6liBl",
    "8hbPhB4lI4",
    "MF",
    "YaCt7r",
    "zFOfd8Q7",
    "onGyL5ptmopt1R",
    "R",
    "TNO2",
    "NwM",
    "7",
    "b",
    "f",
    "YIdGg",
    "mbdhYH",
    "BxJRK4IcXCkAvCzFF",
    "Gsf06RCPTLr",
    "5we_mE95C2",
    "67jQ",
    "_BWp",
    "ONyQDQJDI4D",
    "7o",
    "MN7wnn",
    "YN62M8W",
    "dOs5Y",
    "lIjOE",
    "urxLbspK",
    "p5HY",
    "BGx87d_m0SXtGzvNBIHH",
    "VeK",
    "gM5sqz",
    "UvtyEW0m",
    "s",
    "jnG",
    "eEBY98X",
    "RfypKjgdWenjgM6g",
    "m",
    "9",
    "bMn",
    "i",
    "a",
    "VBoiac",
    "WReawIke2L5jPfg",
    "SOHs",
    "ijimlArfKLuNHAWUxNi9yOCF",
    "CIW4FU6cO",
    "k_Udk3",
    "ml_Pr_0f1",
    "WlHB9",
    "rIx",
    "x9j",
    "EaLXAaiD8Y9hR1",
    "VB",
    "XZU",
    "I",
    "4URKuF",
    "N7hs",
    "VYMMUU",
    "R5JYP",
    "1H_adlksZ",
    "3RgGxwJoCT",
    "wPS_",
    "wj",
    "O",
    "oTcUO",
    "s8",
    "lE",
    "04QU0r",
    "VZ1TpWRA",
    "BY",
    "KR84bQfV",
    "False",
    "4E5",
    "e",
    "h_",
    "Qmpq",
    "sXqMz",
    "qIAvM",
    "Scunthorpe",
    "4T",
    "_",
    "J0m1_afD",
    "UNTt1uLsA6",
    "BdnnRdGw",
    "Y5QXojwveKYuTVWIHtX1",
    "XGp7JV3fE_KdRS",
    "WG_6d",
    "WjsAATh7800m",
    "phrygian"
  ],
  "remainingScales": [],
  "approvedSources": {},
  "rejectedScales": [
    "0",
    "g",
    "j",
    "VbDi",
    "S0rOkK",
    "sye",
    "cm",
    "PTM",
    "S",
    "wjeSggJWQTSO",
    "S7",
    "GL",
    "Fwz6",
    "zCcLkD6liBl",
    "8hbPhB4lI4",
    "MF",
    "YaCt7r",
    "zFOfd8Q7",
    "onGyL5ptmopt1R",
    "R",
    "TNO2",
    "NwM",
    "7",
    "b",
    "f",
    "YIdGg",
    "mbdhYH",
    "BxJRK4IcXCkAvCzFF",
    "Gsf06RCPTLr",
    "5we_mE95C2",
    "67jQ",
    "_BWp",
    "ONyQDQJDI4D",
    "7o",
    "MN7wnn",
    "YN62M8W",
    "dOs5Y",
    "lIjOE",
    "urxLbspK",
    "p5HY",
    "BGx87d_m0SXtGzvNBIHH",
    "VeK",
    "gM5sqz",
    "UvtyEW0m",
    "s",
    "jnG",
    "eEBY98X",
    "RfypKjgdWenjgM6g",
    "m",
    "9",
    "bMn",
    "i",
    "a",
    "VBoiac",
    "WReawIke2L5jPfg",
    "SOHs",
    "ijimlArfKLuNHAWUxNi9yOCF",
    "CIW4FU6cO",
    "k_Udk3",
    "ml_Pr_0f1",
    "WlHB9",
    "rIx",
    "x9j",
    "EaLXAaiD8Y9hR1",
    "VB",
    "XZU",
    "I",
    "4URKuF",
    "N7hs",
    "VYMMUU",
    "R5JYP",
    "1H_adlksZ",
    "3RgGxwJoCT",
    "wPS_",
    "wj",
    "O",
    "oTcUO",
    "s8",
    "lE",
    "04QU0r",
    "VZ1TpWRA",
    "BY",
    "KR84bQfV",
    "False",
    "4E5",
    "e",
    "h_",
    "Qmpq",
    "sXqMz",
    "qIAvM",
    "Scunthorpe",
    "4T",
    "_",
    "J0m1_afD",
    "UNTt1uLsA6",
    "BdnnRdGw",
    "Y5QXojwveKYuTVWIHtX1",
    "XGp7JV3fE_KdRS",
    "WG_6d",
    "WjsAATh7800m",
    "phrygian"
  ]
}